{
  "schemaVersion": 1,
  "rootAuthority": "governance/authority/authority-precedence.json",
  "precedence": [
    {"rank": 1, "id": "CURRENT_USER_INSTRUCTION", "description": "The explicit current-task instruction controls requested scope/actions, subject to platform safety and repository permissions."},
    {"rank": 2, "id": "AUTHORITY_PRECEDENCE_REGISTRY", "description": "This registry resolves repository governance authority conflicts."},
    {"rank": 3, "id": "UNIFIED_GOVERNANCE", "description": "GOVERNANCE.md, the PRD, and the three general policies define durable repository governance for humans and agents alike."},
    {"rank": 4, "id": "CAPABILITY_PRODUCT_TRUTH", "description": "A registered Product Truth contract defines capability-specific product semantics only within its declared scope and cannot contradict unified governance."},
    {"rank": 5, "id": "MACHINE_READABLE_CONTRACT", "description": "Registered schemas, vocabularies, lifecycle, approval, workflow, guard and tool-routing contracts encode governance for automated validation."},
    {"rank": 6, "id": "OWNER_SKILL_CONTRACT", "description": "An active governed skill owns only its declared execution domain and never creates higher policy."},
    {"rank": 7, "id": "TOOL_ADAPTER", "description": "Tools and adapters translate higher rules and own no product truth or approval."},
    {"rank": 8, "id": "DERIVED_SUPPORT_ARTIFACT", "description": "Plans, prompts, runbooks, diagnostics and evidence packages assist execution but never override authority or live implementation/runtime/platform truth."},
    {"rank": 9, "id": "HISTORICAL_REFERENCE", "description": "Git history is evidence only and never current truth."}
  ],
  "documents": [
    {"path": "governance/authority/authority-precedence.json", "classification": "ROOT_AUTHORITY", "precedenceId": "AUTHORITY_PRECEDENCE_REGISTRY", "authorityDomains": ["authority_resolution", "classification"]},
    {"path": "governance/GOVERNANCE.md", "classification": "ACTIVE_CANONICAL", "precedenceId": "UNIFIED_GOVERNANCE", "authorityDomains": ["governance_entry", "repository_boundaries", "execution_model"]},
    {"path": "governance/product/PRD.md", "classification": "ACTIVE_CANONICAL", "precedenceId": "UNIFIED_GOVERNANCE", "authorityDomains": ["product_model", "product_scope", "product_ownership", "product_acceptance"]},
    {"path": "governance/policies/engineering.md", "classification": "ACTIVE_CANONICAL", "precedenceId": "UNIFIED_GOVERNANCE", "authorityDomains": ["architecture", "services", "surfaces", "api_binding", "ui_kit", "database", "migrations", "runtime", "providers", "observability", "performance", "technical_quality"]},
    {"path": "governance/policies/security.md", "classification": "ACTIVE_CANONICAL", "precedenceId": "UNIFIED_GOVERNANCE", "authorityDomains": ["security", "privacy", "secrets", "trusted_context", "isolation"]},
    {"path": "governance/policies/delivery.md", "classification": "ACTIVE_CANONICAL", "precedenceId": "UNIFIED_GOVERNANCE", "authorityDomains": ["branch_execution", "evidence", "sdlc", "ci", "stage_gates", "release", "deployment", "production", "cleanup"]},

    {"path": "governance/product/contracts", "classification": "CONDITIONAL_CANONICAL", "precedenceId": "CAPABILITY_PRODUCT_TRUTH", "authorityDomains": ["capability_product_truth"], "appliesWhen": "The current task affects a capability represented by a registered Product Truth contract under this directory.", "scopeLimit": "Each contract governs only its declared capability and must conform to the PRD and general policies."},

    {"path": "governance/policies/repository-retention-policy.json", "classification": "ACTIVE_CANONICAL", "precedenceId": "MACHINE_READABLE_CONTRACT", "authorityDomains": ["repository_retention", "repository_hygiene"]},
    {"path": "governance/contracts", "classification": "ACTIVE_CANONICAL", "precedenceId": "MACHINE_READABLE_CONTRACT", "authorityDomains": ["decision_vocabulary", "shared_contract_schemas", "technical_registries", "sdlc_machine_contract", "full_verification_routing"]},
    {"path": "governance/agents", "classification": "ACTIVE_CANONICAL", "precedenceId": "MACHINE_READABLE_CONTRACT", "authorityDomains": ["agent_roles", "approval_domains"]},
    {"path": "governance/skills", "classification": "ACTIVE_CANONICAL", "precedenceId": "MACHINE_READABLE_CONTRACT", "authorityDomains": ["skill_lifecycle", "skill_dependencies", "skill_routing"]},
    {"path": "governance/guards", "classification": "ACTIVE_CANONICAL", "precedenceId": "MACHINE_READABLE_CONTRACT", "authorityDomains": ["guard_registry", "guard_assurance", "guard_sets", "static_binding_registry"]},
    {"path": "governance/tools/agent-tool-registry.json", "classification": "ACTIVE_CANONICAL", "precedenceId": "MACHINE_READABLE_CONTRACT", "authorityDomains": ["tool_inventory", "tool_routing_metadata"], "scopeLimit": "This registry governs tool availability/routing metadata only; tools own no approval or repository truth."},
    {"path": "governance/github/workflow-registry.json", "classification": "ACTIVE_CANONICAL", "precedenceId": "MACHINE_READABLE_CONTRACT", "authorityDomains": ["workflow_registry"]},
    {"path": "governance/github/master-protection.ruleset.json", "classification": "ACTIVE_CANONICAL", "precedenceId": "MACHINE_READABLE_CONTRACT", "authorityDomains": ["github_desired_master_ruleset"], "scopeLimit": "Desired configuration only; live GitHub verification is required for enforcement claims."},
    {"path": "governance/authority/direct-work-branch-execution-policy.json", "classification": "ACTIVE_CANONICAL", "precedenceId": "MACHINE_READABLE_CONTRACT", "authorityDomains": ["repository_writes"]},
    {"path": "governance/authority/direct-work-branch-execution-policy.schema.json", "classification": "ACTIVE_CANONICAL", "precedenceId": "MACHINE_READABLE_CONTRACT", "authorityDomains": ["repository_writes_schema"]},
    {"path": "governance/authority/single-owner-mode.json", "classification": "ACTIVE_CANONICAL", "precedenceId": "MACHINE_READABLE_CONTRACT", "authorityDomains": ["single_owner_approval", "approval_identity_exception"]},
    {"path": "governance/authority/single-owner-mode.schema.json", "classification": "ACTIVE_CANONICAL", "precedenceId": "MACHINE_READABLE_CONTRACT", "authorityDomains": ["single_owner_mode_schema"]},
    {"path": "governance/authority/authority-precedence.schema.json", "classification": "ACTIVE_CANONICAL", "precedenceId": "MACHINE_READABLE_CONTRACT", "authorityDomains": ["authority_registry_schema"]},
    {"path": "governance/product/product-truth.schema.json", "classification": "ACTIVE_CANONICAL", "precedenceId": "MACHINE_READABLE_CONTRACT", "authorityDomains": ["product_truth_schema"]},
    {"path": "governance/product/platform-model.yaml", "classification": "ACTIVE_CANONICAL", "precedenceId": "MACHINE_READABLE_CONTRACT", "authorityDomains": ["platform_model_machine_contract"]},

    {"path": ".agents/skills", "classification": "OWNER_CONTRACT", "precedenceId": "OWNER_SKILL_CONTRACT", "authorityDomains": ["declared_active_skill_scope"]},
    {"path": ".agents/tools", "classification": "ADAPTER", "precedenceId": "TOOL_ADAPTER", "authorityDomains": ["conditional_tool_policy"], "scopeLimit": "Tools own no approval or repository truth."},
    {"path": "AGENTS.md", "classification": "ADAPTER", "precedenceId": "TOOL_ADAPTER", "authorityDomains": ["agent_entry_adapter"], "scopeLimit": "Thin pointer to the same unified governance used by human developers."},
    {"path": "CLAUDE.md", "classification": "ADAPTER", "precedenceId": "TOOL_ADAPTER", "authorityDomains": ["claude_adapter"]},
    {"path": "GEMINI.md", "classification": "ADAPTER", "precedenceId": "TOOL_ADAPTER", "authorityDomains": ["gemini_cli_adapter"]},
    {"path": "LEAN-CTX.md", "classification": "ADAPTER", "precedenceId": "TOOL_ADAPTER", "authorityDomains": ["leanctx_adapter"]},
    {"path": "opencode.json", "classification": "ADAPTER", "precedenceId": "TOOL_ADAPTER", "authorityDomains": ["opencode_adapter"]},

    {"path": ".agents/INDEX.md", "classification": "DERIVED_SUPPORT", "precedenceId": "DERIVED_SUPPORT_ARTIFACT", "authorityDomains": ["skill_routing_index"]},
    {"path": "plans/diagnose-implementing", "classification": "DERIVED_SUPPORT", "precedenceId": "DERIVED_SUPPORT_ARTIFACT", "authorityDomains": ["diagnosis_execution_plans"], "scopeLimit": "Disposable task planning packages; no runtime, policy, approval, or product authority."},
    {"path": "plans/smsm-dsh-wlt-journeys", "classification": "DERIVED_SUPPORT", "precedenceId": "DERIVED_SUPPORT_ARTIFACT", "authorityDomains": ["journey_discovery_support"], "scopeLimit": "DSH/WLT discovery and coverage support only."}
  ]
}
